### ISSUE TITLE
ss-redir forward dns problem

### ISSUE THREAD

**Issue by oule** [shadowsocks/shadowsocks-libev#2458]
hello everyone
I have some problems

ss-server-3.1.3    listen on    123.123.123.123:10000 [tcp and udp]
ss-redir-3.1.3    listen on      0.0.0.0:1080  [tcp and udp]

dnsmasq-2.8    on   openwrt base x86
server=/google.com/8.8.8.8#53

iptables-v1.6.2    on   openwrt base x86
iptables -t nat -A OUTPUT -d 8.8.8.8 -p udp -j REDIRECT --to-port 1080

nslookup www.google.com 8.8.8.8#53    on  openwrt base x86
;; connection timed out; no servers could be reached

ss-redir log as below [221.212.141.230 is my openwrt wan ip]
 2019-08-21 11:42:00 INFO: [udp] server receive a packet
 2019-08-21 11:42:00 INFO: [udp] cache miss: 127.0.0.1:1080 <-> 221.212.141.230:49521
 2019-08-21 11:42:00 INFO: [udp] server receive a packet
 2019-08-21 11:42:00 INFO: [udp] cache hit: 127.0.0.1:1080 <-> 221.212.141.230:49521
 2019-08-21 11:42:03 INFO: [udp] server receive a packet
 2019-08-21 11:42:03 INFO: [udp] cache hit: 127.0.0.1:1080 <-> 221.212.141.230:49521
 2019-08-21 11:42:03 INFO: [udp] server receive a packet
 2019-08-21 11:42:03 INFO: [udp] cache hit: 127.0.0.1:1080 <-> 221.212.141.230:49521
 2019-08-21 11:42:23 INFO: [udp] connection timeout
 2019-08-21 11:42:23 INFO: [udp] one connection freed

ss-server tcpdump as below  [172.31.44.230 is my aws lan ip,wan ip is 123.123.123.123]
tcpdump -nNnn port 10000
tcpdump: verbose output suppressed, use -v or -vv for full protocol decode
listening on eth0, link-type EN10MB (Ethernet), capture size 262144 bytes
11:42:00.885100 IP 221.212.141.230.42990 > 172.31.44.230.10000: UDP, length 87
11:42:00.885131 IP 221.212.141.230.42990 > 172.31.44.230.10000: UDP, length 87
11:42:03.400364 IP 221.212.141.230.42990 > 172.31.44.230.10000: UDP, length 87
11:42:03.400393 IP 221.212.141.230.42990 > 172.31.44.230.10000: UDP, length 87
11:42:03.571133 IP 221.212.141.230.36276 > 172.31.44.230.10000: Flags [.], ack 3640857906, win 2800, options [nop,nop,TS val 3991149061 ecr 3947132020], length 0
11:42:03.571166 IP 172.31.44.230.10000 > 221.212.141.230.36276: Flags [.], ack 1, win 230, options [nop,nop,TS val 3947172377 ecr 3990987653], length 0
^C
6 packets captured
6 packets received by filter
0 packets dropped by kernel

Why can't domain name be resolved？
please help me,thanks

**Comment by lixingcong** [comment]
Try [ss-nat](https://github.com/shadowsocks/luci-app-shadowsocks/blob/master/files/root/usr/bin/ss-rules) to re-direct all traffic.

For convenience, use [luci-app-shadowsocks](https://github.com/shadowsocks/luci-app-shadowsocks) under OpenWRT would be better.

**Comment by oule** [comment]
@lixingcong
It's solved.
I use tcp instead of udp,may be the udp protocol was blocked.
use unbound software translate udp to tcp over ss-redir proxy.
thank you very much.
