### ISSUE TITLE
Data reception bug during a long tcp session (>300s)

### ISSUE THREAD

**Issue by johaven** [shadowsocks/shadowsocks-libev#2780]
### What version of shadowsocks-libev are you using?
3.3.5

### What operating system are you using?
centos 7

### What did you do?
ss-redir to ss-server

### Bug
SCHEMA : client-http -> ss-redir -> ss-server -> http-server

If the connection has a lifespan of more than 300 seconds the expected return response (http server -> ss-server) is not not received (or processed) and therefore not forwarded to the client (ss-redir).

I traced on the http server and the response (from http-server) is well send to ss-server, but ss-server do not received or processes the http request (i don't know why)

If the response (http request) is generated before 300 seconds, the client-http receive correctly the response.

My http-server has a long read_timeout (14400), the problem is not on this side.
If i do not use ss-redir and ss-server all is working good.

### What is your config in detail (with all sensitive info masked)?
```python
shadow_conf = {
    "server": x.x.x.x,
    "server_port": 8388,
    "local_address": "0.0.0.0",
    "local_port": 1080,
    "password": "password",
    "timeout": 900,
    "method": "rc4-md5",
    "reuse_port": True,
    "fast_open": True,
    "no_delay": True,
    "mptcp": True,
    "mode": "tcp_and_udp",
    "verbose": True
}
rules = {
        'fs.file-max': '51200',
        'net.core.rmem_max': '67108864',
        'net.core.wmem_max': '67108864',
        'net.core.netdev_max_backlog': '250000',
        'net.core.somaxconn': '4096',
        'net.ipv4.tcp_syncookies': '1',
        'net.ipv4.tcp_tw_reuse': '1',
        'net.ipv4.tcp_tw_recycle': '0',
        'net.ipv4.tcp_fin_timeout': '30',
        'net.ipv4.tcp_keepalive_time': '1200',
        'net.ipv4.ip_local_port_range': '10000 65000',
        'net.ipv4.tcp_max_syn_backlog': '8192',
        'net.ipv4.tcp_max_tw_buckets': '5000',
        'net.ipv4.tcp_fastopen': '3',
        'net.ipv4.tcp_mem': '25600 51200 102400',
        'net.ipv4.tcp_rmem': '4096 87380 67108864',
        'net.ipv4.tcp_wmem': '4096 65536 67108864',
        'net.ipv4.tcp_mtu_probing': '1',
        'net.core.default_qdisc': 'fq',
        'net.ipv4.tcp_congestion_control': 'bbr'
    }
```

**Comment by madeye** [comment]
Can you enable the verbose logging and post the logs of shadowsocks here?

**Comment by johaven** [comment]
I already enabled verbose logging during my tests, i see the opened connection but nothing is send on it.

**Comment by madeye** [comment]
If the connection is not closed due to timeout, at least  `ss-server` should receive the response from http server.

Can you trace this on the server side with tcpdump?

**Comment by johaven** [comment]
```log

HTTP-SERVER LOG
[pid: 13079|app: 0|req: 2/2] SS-SERVER () {46 vars in 1176 bytes} [Tue Dec 22 00:26:24 2020] POST /api/v1/sync/diff => generated 3556 bytes in 912220 msecs (HTTP/1.1 200) 2 headers in 81 bytes (3 switches on core 499)

SS-SERVER TCPDUMP
00:26:24.118006 IP SS-SERVER.55936 > HTTP-SERVER.443: Flags [S], seq 3242665769, win 42340, options [mss 1460,sackOK,TS val 1933639134 ecr 0,nop,wscale 11,mptcp capable csum {0x72dde18a867b708d}], length 0
00:26:24.118245 IP HTTP-SERVER.443 > SS-SERVER.55936: Flags [S.], seq 285451189, ack 3242665770, win 65160, options [mss 1460,sackOK,TS val 2508802418 ecr 1933639134,nop,wscale 7], length 0
00:26:24.118288 IP SS-SERVER.55936 > HTTP-SERVER.443: Flags [.], ack 1, win 21, options [nop,nop,TS val 1933639135 ecr 2508802418], length 0
00:26:24.118325 IP SS-SERVER.55936 > HTTP-SERVER.443: Flags [P.], seq 1:245, ack 1, win 21, options [nop,nop,TS val 1933639135 ecr 2508802418], length 244
00:26:24.118584 IP HTTP-SERVER.443 > SS-SERVER.55936: Flags [.], ack 245, win 508, options [nop,nop,TS val 2508802418 ecr 1933639135], length 0
00:26:24.121095 IP HTTP-SERVER.443 > SS-SERVER.55936: Flags [P.], seq 1:3017, ack 245, win 508, options [nop,nop,TS val 2508802420 ecr 1933639135], length 3016
00:26:24.121122 IP SS-SERVER.55936 > HTTP-SERVER.443: Flags [.], ack 3017, win 21, options [nop,nop,TS val 1933639138 ecr 2508802420], length 0
00:26:24.222090 IP SS-SERVER.55936 > HTTP-SERVER.443: Flags [P.], seq 245:371, ack 3017, win 21, options [nop,nop,TS val 1933639239 ecr 2508802420], length 126
00:26:24.222316 IP HTTP-SERVER.443 > SS-SERVER.55936: Flags [.], ack 371, win 508, options [nop,nop,TS val 2508802522 ecr 1933639239], length 0
00:26:24.222657 IP HTTP-SERVER.443 > SS-SERVER.55936: Flags [P.], seq 3017:3275, ack 371, win 508, options [nop,nop,TS val 2508802522 ecr 1933639239], length 258
00:26:24.222677 IP SS-SERVER.55936 > HTTP-SERVER.443: Flags [.], ack 3275, win 21, options [nop,nop,TS val 1933639239 ecr 2508802522], length 0
00:26:24.285472 IP SS-SERVER.55936 > HTTP-SERVER.443: Flags [P.], seq 371:1186, ack 3275, win 21, options [nop,nop,TS val 1933639302 ecr 2508802522], length 815
00:26:24.285729 IP HTTP-SERVER.443 > SS-SERVER.55936: Flags [.], ack 1186, win 502, options [nop,nop,TS val 2508802585 ecr 1933639302], length 0
00:26:24.287654 IP SS-SERVER.55936 > HTTP-SERVER.443: Flags [P.], seq 1186:1285, ack 3275, win 21, options [nop,nop,TS val 1933639304 ecr 2508802585], length 99
00:26:24.287888 IP HTTP-SERVER.443 > SS-SERVER.55936: Flags [.], ack 1285, win 502, options [nop,nop,TS val 2508802587 ecr 1933639304], length 0

HTTP-SERVER TCPDUMP
00:26:24.118395 IP SS-SERVER.55936 > HTTP-SERVER.443: Flags [S], seq 3242665769, win 42340, options [mss 1460,sackOK,TS val 1933639134 ecr 0,nop,wscale 11,mptcp capable csum {0x72dde18a867b708d}], length 0
00:26:24.118413 IP HTTP-SERVER.443 > SS-SERVER.55936: Flags [S.], seq 285451189, ack 3242665770, win 65160, options [mss 1460,sackOK,TS val 2508802418 ecr 1933639134,nop,wscale 7], length 0
00:26:24.118675 IP SS-SERVER.55936 > HTTP-SERVER.443: Flags [.], ack 1, win 21, options [nop,nop,TS val 1933639135 ecr 2508802418], length 0
00:26:24.118707 IP SS-SERVER.55936 > HTTP-SERVER.443: Flags [P.], seq 1:245, ack 1, win 21, options [nop,nop,TS val 1933639135 ecr 2508802418], length 244
00:26:24.118716 IP HTTP-SERVER.443 > SS-SERVER.55936: Flags [.], ack 245, win 508, options [nop,nop,TS val 2508802418 ecr 1933639135], length 0
00:26:24.121203 IP HTTP-SERVER.443 > SS-SERVER.55936: Flags [P.], seq 1:3017, ack 245, win 508, options [nop,nop,TS val 2508802420 ecr 1933639135], length 3016
00:26:24.121496 IP SS-SERVER.55936 > HTTP-SERVER.443: Flags [.], ack 3017, win 21, options [nop,nop,TS val 1933639138 ecr 2508802420], length 0
00:26:24.222476 IP SS-SERVER.55936 > HTTP-SERVER.443: Flags [P.], seq 245:371, ack 3017, win 21, options [nop,nop,TS val 1933639239 ecr 2508802420], length 126
00:26:24.222490 IP HTTP-SERVER.443 > SS-SERVER.55936: Flags [.], ack 371, win 508, options [nop,nop,TS val 2508802522 ecr 1933639239], length 0
00:26:24.222816 IP HTTP-SERVER.443 > SS-SERVER.55936: Flags [P.], seq 3017:3275, ack 371, win 508, options [nop,nop,TS val 2508802522 ecr 1933639239], length 258
00:26:24.223049 IP SS-SERVER.55936 > HTTP-SERVER.443: Flags [.], ack 3275, win 21, options [nop,nop,TS val 1933639239 ecr 2508802522], length 0
00:26:24.285880 IP SS-SERVER.55936 > HTTP-SERVER.443: Flags [P.], seq 371:1186, ack 3275, win 21, options [nop,nop,TS val 1933639302 ecr 2508802522], length 815
00:26:24.285894 IP HTTP-SERVER.443 > SS-SERVER.55936: Flags [.], ack 1186, win 502, options [nop,nop,TS val 2508802585 ecr 1933639302], length 0
00:26:24.288038 IP SS-SERVER.55936 > HTTP-SERVER.443: Flags [P.], seq 1186:1285, ack 3275, win 21, options [nop,nop,TS val 1933639304 ecr 2508802585], length 99
00:26:24.288048 IP HTTP-SERVER.443 > SS-SERVER.55936: Flags [.], ack 1285, win 502, options [nop,nop,TS val 2508802587 ecr 1933639304], length 0
00:41:36.507057 IP HTTP-SERVER.443 > SS-SERVER.55936: Flags [P.], seq 3275:5894, ack 1285, win 502, options [nop,nop,TS val 2509714806 ecr 1933639304], length 2619
00:41:36.522443 IP HTTP-SERVER.443 > SS-SERVER.55936: Flags [P.], seq 4723:5894, ack 1285, win 502, options [nop,nop,TS val 2509714822 ecr 1933639304], length 1171
00:41:36.730462 IP HTTP-SERVER.443 > SS-SERVER.55936: Flags [.], seq 3275:4723, ack 1285, win 502, options [nop,nop,TS val 2509715030 ecr 1933639304], length 1448
00:41:37.158450 IP HTTP-SERVER.443 > SS-SERVER.55936: Flags [.], seq 3275:4723, ack 1285, win 502, options [nop,nop,TS val 2509715458 ecr 1933639304], length 1448
00:41:37.990480 IP HTTP-SERVER.443 > SS-SERVER.55936: Flags [.], seq 3275:4723, ack 1285, win 502, options [nop,nop,TS val 2509716290 ecr 1933639304], length 1448
00:41:39.654440 IP HTTP-SERVER.443 > SS-SERVER.55936: Flags [.], seq 3275:4723, ack 1285, win 502, options [nop,nop,TS val 2509717954 ecr 1933639304], length 1448
00:41:43.014443 IP HTTP-SERVER.443 > SS-SERVER.55936: Flags [.], seq 3275:4723, ack 1285, win 502, options [nop,nop,TS val 2509721314 ecr 1933639304], length 1448
00:41:49.670487 IP HTTP-SERVER.443 > SS-SERVER.55936: Flags [.], seq 3275:4723, ack 1285, win 502, options [nop,nop,TS val 2509727970 ecr 1933639304], length 1448
00:42:02.982472 IP HTTP-SERVER.443 > SS-SERVER.55936: Flags [.], seq 3275:4723, ack 1285, win 502, options [nop,nop,TS val 2509741282 ecr 1933639304], length 1448
00:42:30.374449 IP HTTP-SERVER.443 > SS-SERVER.55936: Flags [.], seq 3275:4723, ack 1285, win 502, options [nop,nop,TS val 2509768674 ecr 1933639304], length 1448
00:42:41.509882 IP HTTP-SERVER.443 > SS-SERVER.55936: Flags [FP.], seq 5894:5925, ack 1285, win 502, options [nop,nop,TS val 2509779809 ecr 1933639304], length 31
```

**Comment by johaven** [comment]
Now if i close connection from HTTP-CLIENT:

```log
SS-SERVER TCPDUMP
00:44:48.693895 IP SS-SERVER.55936 > HTTP-SERVER.443: Flags [F.], seq 3242667054, ack 285454464, win 21, options [nop,nop,TS val 1934743718 ecr 2508802587], length 0
00:44:48.899602 IP SS-SERVER.55936 > HTTP-SERVER.443: Flags [F.], seq 0, ack 1, win 21, options [nop,nop,TS val 1934743924 ecr 2508802587], length 0
00:44:49.107609 IP SS-SERVER.55936 > HTTP-SERVER.443: Flags [F.], seq 0, ack 1, win 21, options [nop,nop,TS val 1934744132 ecr 2508802587], length 0
00:44:49.527655 IP SS-SERVER.55936 > HTTP-SERVER.443: Flags [F.], seq 0, ack 1, win 21, options [nop,nop,TS val 1934744552 ecr 2508802587], length 0
00:44:50.359684 IP SS-SERVER.55936 > HTTP-SERVER.443: Flags [F.], seq 0, ack 1, win 21, options [nop,nop,TS val 1934745384 ecr 2508802587], length 0
00:44:52.023628 IP SS-SERVER.55936 > HTTP-SERVER.443: Flags [F.], seq 0, ack 1, win 21, options [nop,nop,TS val 1934747048 ecr 2508802587], length 0
00:44:55.351632 IP SS-SERVER.55936 > HTTP-SERVER.443: Flags [F.], seq 0, ack 1, win 21, options [nop,nop,TS val 1934750376 ecr 2508802587], length 0
00:45:02.007671 IP SS-SERVER.55936 > HTTP-SERVER.443: Flags [F.], seq 0, ack 1, win 21, options [nop,nop,TS val 1934757032 ecr 2508802587], length 0
00:45:15.319700 IP SS-SERVER.55936 > HTTP-SERVER.443: Flags [F.], seq 0, ack 1, win 21, options [nop,nop,TS val 1934770344 ecr 2508802587], length 0
00:45:41.943659 IP SS-SERVER.55936 > HTTP-SERVER.443: Flags [F.], seq 0, ack 1, win 21, options [nop,nop,TS val 1934796968 ecr 2508802587], length 0
```

**Comment by johaven** [comment]
Any new about this bug ?

**Comment by madeye** [comment]
I cannot reproduce your issue locally. Also I noticed you enabled those options:

```
    "reuse_port": True,
    "fast_open": True,
    "no_delay": True,
    "mptcp": True,
```

Disable them and try again.

**Comment by madeye** [comment]
BTW, you can also try this implementation: https://github.com/shadowsocks/shadowsocks-rust
